,Season,EpisodeNo,Title,AirDate,Writers,Director,SEID,Summary
140,8.0,10.0,The Andrea Doria,"December 19, 1996",Spike Feresten,Andy Ackerman,S08E10,A Kenny Rogers Roasters sign keeps Kramer awake. Jerry and Kramer switch apartments.
141,8.0,11.0,The Little Jerry,"January 9, 1997",Jennifer Crittenden,Andy Ackerman,S08E11,George becomes smarter when he stops having sex. Elaine's boyfriend won't have sex before becoming a doctor.
142,8.0,12.0,The Money,"January 16, 1997",Peter Mehlman,Andy Ackerman,S08E12,George competes for an apartment with a survivor of the Andrea Doria ship disaster.
143,8.0,13.0,The Comeback,"January 30, 1997","Gregg Kavet, Andy Robin",David Owen Trainor,S08E13,Kramer names a rooster after Jerry and enters it in cockfighting. Jerry dates a woman who's done time in prison.
144,8.0,14.0,The Van Buren Boys,"February 6, 1997",Darin Henry,Andy Ackerman,S08E14,Jerry's parents sell their Cadillac thinking he needs money. Kramer retires to Florida.
145,8.0,15.0,The Susie,"February 13, 1997",David Mandel,Andy Ackerman,S08E15,George obsesses over a comeback line. Jerry's tennis instructor gives him relationship advice.
146,8.0,16.0,The Pothole,"February 20, 1997",Steve O'Donnell and Dan O'Keefe,Andy Ackerman,S08E16,Jerry mentors a troubled youth. George interviews candidates for a scholarship from the Susan Ross Foundation.
147,8.0,17.0,The English Patient,"March 13, 1997",Steve Koren,Andy Ackerman,S08E17,"Elaine is mistaken for someone named Susie. Jerry dates a woman who calls him ""Jerry"" too much."
148,8.0,18.0,The Nap,"April 10, 1997","Gregg Kavet, Andy Robin",Andy Ackerman,S08E18,Jerry's girlfriend's toothbrush falls in the toilet. Elaine tries to get Chinese food delivered.
149,8.0,19.0,The Yada Yada,"April 24, 1997",Peter Mehlman and Jill Franklyn,Andy Ackerman,S08E19,Elaine hates The English Patient. Jerry dates a woman who looks different in different lighting.
150,8.0,20.0,The Millennium,"May 1, 1997",Jennifer Crittenden,Andy Ackerman,S08E20,George installs a bed under his desk at work. Jerry's kitchen is being renovated.
151,8.0,21.0,The Muffin Tops,"May 8, 1997",Spike Feresten,Andy Ackerman,S08E21,Jerry's dentist converts to Judaism and immediately starts telling Jewish jokes.
152,8.0,22.0,The Summer of George,"May 15, 1997","Alec Berg, Jeff Schaffer",Andy Ackerman,S08E22,George tries to get fired from the Yankees to take a better job with the Mets.
153,9.0,1.0,The Butter Shave,"September 25, 1997","Alec Berg, Jeff Schaffer, David Mandel",Andy Ackerman,S09E01,Elaine starts a business selling just muffin tops. Mr. Lippman steals her idea.
154,9.0,2.0,The Voice,"October 2, 1997","Alec Berg, Jeff Schaffer, David Mandel",Andy Ackerman,S09E02,George gets a severance package from the Yankees and plans a summer of leisure.
155,9.0,3.0,The Serenity Now,"October 9, 1997",Steve Koren,Andy Ackerman,S09E03,Kramer uses butter as a shaving cream and ends up smelling like a human butter cookie.
156,9.0,4.0,The Blood,"October 16, 1997",Dan O'Keefe,Andy Ackerman,S09E04,Jerry gives his girlfriend's stomach a voice. George's boss catches him having sex in his office.
157,9.0,5.0,The Junk Mail,"October 30, 1997",Spike Feresten,Andy Ackerman,S09E05,Jerry's new girlfriend encourages him to express his emotions. Frank Costanza practices anger management.
158,9.0,6.0,The Merv Griffin Show,"November 6, 1997",Bruce Eric Kaplan,Andy Ackerman,S09E06,Jerry's parents want him to store his blood. George combines food sex and TV.
159,9.0,7.0,The Slicer,"November 13, 1997","Gregg Kavet, Andy Robin",Andy Ackerman,S09E07,Kramer tries to stop his mail. Jerry buys his parents a Wizard computer.
160,9.0,8.0,The Betrayal,"November 20, 1997","David Mandel, Peter Mehlman",Andy Ackerman,S09E08,Kramer recreates The Merv Griffin Show set in his apartment.
161,9.0,9.0,The Apology,"December 11, 1997",Jennifer Crittenden,Andy Ackerman,S09E09,Jerry dates a dermatologist. George gets a job as a Yankee food processor.
162,9.0,10.0,The Strike,"December 18, 1997","Dan O'Keefe, Alec Berg, Jeff Schaffer",Andy Ackerman,S09E10,Shown in reverse chronological order this episode follows events at a wedding in India.
163,9.0,11.0,The Dealership,"January 8, 1998",Steve Koren,Andy Ackerman,S09E11,George wants an apology from an old friend in AA. Jerry's girlfriend is a germaphobe.
164,9.0,12.0,The Reverse Peephole (a.k.a. The Man Fur),"January 15, 1998",Spike Feresten,Andy Ackerman,S09E12,Kramer returns to work at H&H Bagels after a 12-year strike. George creates Festivus.
165,9.0,13.0,The Cartoon,"January 29, 1998",Bruce Eric Kaplan,Andy Ackerman,S09E13,Puddy is promoted to car salesman. Jerry tries to get a good deal on a new car.
166,9.0,14.0,The Strongbox,"February 5, 1998",Dan O'Keefe,Andy Ackerman,S09E14,Jerry carries a European carry-all (man purse). Newman plans a birthday party.
167,9.0,15.0,The Wizard,"February 26, 1998",Steve Lookner,Andy Ackerman,S09E15,Elaine's New Yorker cartoon makes no sense. Kramer has a girl stalker.
168,9.0,16.0,The Burning,"March 19, 1998",Jennifer Crittenden,Andy Ackerman,S09E16,Jerry's girlfriend has a mysterious lockbox. Kramer gets a pet parrot.
169,9.0,17.0,The Bookstore,"April 9, 1998",Spike Feresten,Andy Ackerman,S09E17,Jerry buys his father an electronic organizer. Kramer pretends to move to Florida.
170,9.0,18.0,The Frogger,"April 23, 1998","Gregg Kavet, Andy Robin",Andy Ackerman,S09E18,"Jerry's girlfriend says ""that's what they want you to think."" Kramer and Mickey act out diseases."
171,9.0,19.0,The Maid,"April 30, 1998","Alec Berg, David Mandel, Jeff Schaffer",Andy Ackerman,S09E19,Jerry gets banned from a bookstore. George gets caught reading in the bathroom.
172,9.0,20.0,The Puerto Rican Day,"May 7, 1998","Alec Berg, Jennifer Crittenden, Spike Feresten, Bruce Eric Kaplan, Gregg Kavet, Steve Koren, David Mandel, Dan O'Keefe, Andy Robin and Jeff Schaffer.",Andy Ackerman,S09E20,George tries to preserve his high score on an old Frogger machine.
173,9.0,23.0,The Finale,"May 14, 1998",Larry David,Andy Ackerman,S09E23,Jerry dates his maid. Kramer changes his sleep schedule to spend more time with his girlfriend.